{"schema_version":1,"id":"y1_spring_new_soil_quest","title":"新土與沉默鐘聲","summary":"以第一份收成證明你願意在霧落村扎根。","prerequisites":[],"objectives":[{"id":"first_harvest","type":"collect","target":"any_crop","count":1}],"rewards":[{"type":"currency","id":"gold","count":300}],"dialogue_refs":["y1_spring_new_soil_dialogue"]}
