{"schema_version":1,"id":"y2_summer_forge_promise_quest","title":"四封未寄出的信","summary":"理解四名候選各自的人生，再準備一件能同行的升級工具。","prerequisites":[{"flag":"chapter_y2_spring_roots_below"}],"objectives":[{"id":"know_four","type":"talk","target":"romance_candidate","count":4},{"id":"upgrade_tool","type":"flag","target":"tool_upgrade","count":1}],"rewards":[{"type":"item","id":"gold_ore","count":6},{"type":"currency","id":"gold","count":1800}],"dialogue_refs":["y2_summer_forge_promise_dialogue"]}
