{"schema_version":1,"id":"y2_winter_third_seal_quest","title":"第三枚封印","summary":"擊碎秋穗石魔像的枷鎖，讓第三種鐘音歸位。","prerequisites":[{"flag":"chapter_y2_autumn_memory_market"}],"objectives":[{"id":"defeat_harvest_golem","type":"defeat","target":"autumn_harvest_golem","count":1}],"rewards":[{"type":"item","id":"gold_ore","count":6}],"dialogue_refs":["y2_winter_third_seal_dialogue"]}
