{"schema_version":1,"id":"y1_winter_frozen_note_quest","title":"十人的冬宴","summary":"讓節慶成為村落會議，收集至少四段生活記憶。","prerequisites":[{"flag":"chapter_y1_autumn_shared_harvest"}],"objectives":[{"id":"attend_festival","type":"flag","target":"festival_attended","count":1},{"id":"befriend_four","type":"talk","target":"any_villager","count":4}],"rewards":[{"type":"item","id":"animal_feed","count":20},{"type":"currency","id":"gold","count":1000}],"dialogue_refs":["y1_winter_frozen_note_dialogue"]}
