{"schema_version":1,"id":"y3_winter_bell_reborn_quest","title":"十人、四心與重生鐘聲","summary":"以最終核心、二十次鐘網運作與八段羈絆喚醒鐘塔；所有生活選擇都能進入結局。","prerequisites":[{"flag":"chapter_y3_autumn_last_seal"}],"objectives":[{"id":"defeat_final_core","type":"defeat","target":"final_boss","count":1},{"id":"eight_bonds","type":"talk","target":"any_villager","count":8},{"id":"twenty_cycles","type":"flag","target":"automation_cycles","count":20}],"rewards":[{"type":"item","id":"warden_emblem","count":1},{"type":"currency","id":"gold","count":10000}],"dialogue_refs":["y3_winter_bell_reborn_dialogue"]}
