{"schema_version":1,"id":"y3_autumn_last_seal_quest","title":"向無星之海拋竿","summary":"完成八種異潮圖鑑，在夢岸直面克蘇魯之影。","prerequisites":[{"flag":"chapter_y3_summer_bell_makers"}],"objectives":[{"id":"complete_tide_catalog","type":"collect","target":"unique_eldritch_fish","count":8},{"id":"defeat_cthulhu_shadow","type":"defeat","target":"drowned_dreamer","count":1}],"rewards":[{"type":"item","id":"dream_tide_salt","count":3},{"type":"currency","id":"gold","count":6000}],"dialogue_refs":["y3_autumn_last_seal_dialogue"]}
