{"schema_version":1,"id":"y1_summer_tide_echo_quest","title":"潮聲中的裂紋","summary":"深入春之地層，讓第一枚封印回應村莊。","prerequisites":[{"flag":"chapter_y1_spring_new_soil"}],"objectives":[{"id":"reach_spring_guardian","type":"reach","target":"dungeon_floor_10","count":1},{"id":"defeat_spring_guardian","type":"defeat","target":"spring_root_guardian","count":1}],"rewards":[{"type":"item","id":"health_potion","count":2}],"dialogue_refs":["y1_summer_tide_echo_dialogue"]}
