{"schema_version":1,"id":"y3_summer_bell_makers_quest","title":"四十層下的造鐘者","summary":"抵達鐘窟底層，證明鐘塔與農場網路同為深潮封印機。","prerequisites":[{"flag":"chapter_y3_spring_greenhouse_light"}],"objectives":[{"id":"reach_forty","type":"reach","target":"dungeon_floor_40","count":1},{"id":"clear_guardians","type":"defeat","target":"dungeon_monster","count":40}],"rewards":[{"type":"item","id":"gold_ore","count":20},{"type":"currency","id":"gold","count":4200}],"dialogue_refs":["y3_summer_bell_makers_dialogue"]}
