{"schema_version":1,"id":"y3_spring_greenhouse_light_quest","title":"溫室裡的光","summary":"讓農場跨越季節，也讓一段羈絆走到能共同生活的地方。","prerequisites":[{"flag":"chapter_y2_winter_third_seal"}],"objectives":[{"id":"farm_rank_eight","type":"reach","target":"farm_rank_8","count":1},{"id":"ten_hearts","type":"talk","target":"relationship_10_hearts","count":1}],"rewards":[{"type":"item","id":"ancient_seed","count":1}],"dialogue_refs":["y3_spring_greenhouse_light_dialogue"]}
