{"schema_version":1,"id":"y2_autumn_memory_market_quest","title":"夢潮鹽的記憶市集","summary":"把四種異魚記憶凝析成安全、可分享的農產。","prerequisites":[{"flag":"chapter_y2_summer_forge_promise"}],"objectives":[{"id":"four_tide_species","type":"collect","target":"unique_eldritch_fish","count":4},{"id":"three_processed","type":"collect","target":"automation_product","count":3}],"rewards":[{"type":"item","id":"mist_shard","count":20},{"type":"currency","id":"gold","count":2200}],"dialogue_refs":["y2_autumn_memory_market_dialogue"]}
