{"schema_version":1,"id":"y2_spring_roots_below_quest","title":"根系之下","summary":"追隨鐘塔根系進入第二區，奪回夏之封印。","prerequisites":[{"flag":"chapter_y1_winter_frozen_note"}],"objectives":[{"id":"reach_forge_drake","type":"reach","target":"dungeon_floor_20","count":1},{"id":"defeat_forge_drake","type":"defeat","target":"summer_forge_drake","count":1}],"rewards":[{"type":"item","id":"copper_ore","count":8}],"dialogue_refs":["y2_spring_roots_below_dialogue"]}
