{"schema_version":1,"id":"y1_autumn_shared_harvest_quest","title":"共享的第一穗","summary":"擴建農場，並在祭典上把第一年的收成交給村莊。","prerequisites":[{"flag":"chapter_y1_summer_tide_echo"}],"objectives":[{"id":"farm_rank_three","type":"reach","target":"farm_rank_3","count":1},{"id":"attend_festival","type":"flag","target":"festival_attended","count":1}],"rewards":[{"type":"item","id":"animal_feed","count":20}],"dialogue_refs":["y1_autumn_shared_harvest_dialogue"]}
